,query,role,respond
0,Summarize the news list shared and provide how it can impact the share price of BP,energy and economy advisor,"Here's a summary of the news items shared and their potential impact on BP's share price:

1. **Bio-Diesel Market Growth**: The outlook for the biodiesel market indicates significant growth opportunities, particularly in sustainable aviation fuel and diversified feedstocks. For BP, this could signify a shift toward renewable energy investments, potentially boosting their share price if they capitalize on these opportunities.

2. **Weekly Climate and Energy News Roundup**: General updates on climate and energy trends may influence investor sentiment positively or negatively, depending on the content of the news. A focus on sustainability could enhance BP's image and share price if perceived positively.

3. **Azerbaijan-Israel Energy Cooperation**: Increased energy cooperation between Azerbaijan and Israel suggests potential geopolitical stability in the region, which may have indirect effects on global oil prices. BP's share price could benefit if oil prices rise due to enhanced market stability.

4. **Internal Challenges at BP**: Reports of BP's struggles with its energy transition and leadership shake-ups could negatively impact investor confidence, leading to a potential drop in share price. This news highlights internal instability that could deter investment.

5. **Heat Transfer Fluids Market Growth**: The projected growth in the heat transfer fluids market might present opportunities for BP, particularly if they can integrate this into their renewable energy portfolio. A positive angle could support their share price.

6. **Divestment in Austria**: BP's decision to sell fuel retail sites and charging infrastructure in Austria indicates a strategic shift, which could be seen as a positive move toward focusing on core competencies and potentially boosting share price if investors view it as a step toward optimizing their asset base.

7. **Brazil's Energy Strategy**: Brazil's ambitions in energy transition and ethanol could create competitive pressures for BP in the renewable sector. If BP fails to adapt effectively, this could negatively impact their market position and share price.

8. **Middle East Hydrogen Market Growth**: The report on hydrogen market growth in the Middle East could present opportunities for BP to invest in hydrogen technologies, potentially enhancing their share price if they are able to enter and capitalize on this burgeoning market.

9. **India's Oil Investments**: India's plans for significant investments in oil may influence global oil supply dynamics, which could impact BP positively if oil prices rise due to increased demand.

10. **Environmental Concerns**: The call from Oceana to protect the Gulf of Mexico from oil exploitation reflects growing environmental pressures. Negative public sentiment and regulatory challenges could adversely affect BP's operations and share price if they face backlash.

Overall, while there are some growth opportunities highlighted in the renewable energy sector that could positively impact BP's share price, internal challenges and external pressures from environmental groups and geopolitical factors could pose risks. Investors should monitor BP's strategic decisions in response to these trends to gauge their potential impact on the share price."
